{
  "taskId": "FOUNDATION-001",
  "status": "accepted",
  "content": "The deterministic foundation contracts validate successfully.",
  "sourceIds": ["SRC-001"],
  "uncertainties": [],
  "assumptions": [],
  "nextAction": "Review the repository and choose the first real pilot task.",
  "createdAt": "2026-10-20T00:00:00.000Z"
}
